{
  "$schema": "https://json-schema.org/draft/2020-12/schema",
  "$id": "./config.schema.json",
  "title": "mcp-ssh configuration",
  "description": "JSON Schema (Draft 2020-12) for the mcp-ssh configuration file. This schema mirrors the strict validation performed by ``ConfigManager._validate`` in lib/config.py. Note: a few runtime-only constraints cannot be fully expressed in JSON Schema and are enforced at load time (e.g. regex validity of block_patterns, CIDR overlap between networks, and rule targets referencing an existing ssh_target).",
  "type": "object",
  "additionalProperties": false,
  "required": [
    "version",
    "ssh_targets",
    "allowed_commands",
    "settings"
  ],
  "properties": {
    "$schema": {
      "description": "JSON Schema dialect URI — used by editors and CI tooling for autocomplete and validation; ignored by the runtime.",
      "type": "string"
    },
    "version": {
      "description": "Config schema version. Only version 1 is currently supported.",
      "const": 1
    },
    "ssh_targets": {
      "description": "Map of SSH target identifiers to their connection settings. Must be non-empty. Count is enforced at load time (see MAX_TARGETS).",
      "type": "object",
      "minProperties": 1,
      "maxProperties": 1000,
      "propertyNames": {
        "minLength": 1
      },
      "additionalProperties": {
        "$ref": "#/$defs/sshTarget"
      }
    },
    "block_patterns": {
      "description": "Regular expressions that deny a command if matched. Each entry must be a valid regex and must not contain ReDoS-prone constructs such as nested quantifiers (validity and ReDoS risk are enforced at load time). Count and pattern length are enforced at load time.",
      "type": "array",
      "items": {
        "type": "string",
        "maxLength": 10000
      },
      "default": [],
      "maxItems": 500
    },
    "allowed_commands": {
      "description": "Layered command authorization rules: default rules for all clients, plus per-API-key and per-network rules.",
      "type": "object",
      "additionalProperties": false,
      "required": [
        "default",
        "api_keys",
        "networks"
      ],
      "properties": {
        "default": {
          "description": "Rules applied to every client. Must be a non-empty list.",
          "type": "array",
          "minItems": 1,
          "items": {
            "$ref": "#/$defs/rule"
          }
        },
        "api_keys": {
          "description": "Per-API-key rules. Empty list is allowed.",
          "type": "array",
          "items": {
            "$ref": "#/$defs/apiKey"
          }
        },
        "networks": {
          "description": "Per-source-CIDR rules. Empty list is allowed; overlapping ranges are rejected at load time.",
          "type": "array",
          "items": {
            "$ref": "#/$defs/network"
          }
        }
      }
    },
    "settings": {
      "$ref": "#/$defs/settings"
    }
  },
  "$defs": {
    "sshTarget": {
      "description": "Connection settings for a single SSH target. At least one of private_key or password must be provided (enforced at load time).",
      "type": "object",
      "additionalProperties": false,
      "required": [
        "host",
        "username"
      ],
      "properties": {
        "host": {
          "type": "string",
          "minLength": 1
        },
        "port": {
          "description": "TCP port. Defaults to 22 when omitted.",
          "type": "integer",
          "minimum": 1,
          "maximum": 65535,
          "default": 22
        },
        "username": {
          "type": "string",
          "minLength": 1
        },
        "private_key": {
          "type": "string",
          "minLength": 1
        },
        "password": {
          "type": "string",
          "minLength": 1
        },
        "checkcommand": {
          "type": "string",
          "minLength": 1,
          "default": "echo ping",
          "description": "Command executed to verify SSH connectivity"
        }
      }
    },
    "rule": {
      "description": "A command-allowance rule: a list of targets and the commands permitted on them.",
      "type": "object",
      "additionalProperties": false,
      "required": [
        "targets",
        "commands"
      ],
      "properties": {
        "targets": {
          "type": "array",
          "minItems": 1,
          "items": {
            "type": "string",
            "minLength": 1
          }
        },
        "commands": {
          "type": "array",
          "minItems": 1,
          "items": {
            "type": "string"
          }
        },
        "sudo_allowed": {
          "description": "Commands from this rule's 'commands' list permitted to run with sudo. '*' permits every command in the rule.",
          "type": "array",
          "items": {
            "type": "string",
            "minLength": 1
          }
        }
      }
    },
    "apiKey": {
      "description": "A named API key with its own set of command rules. key_hash must be 'sha256:<64 hex>' or 'pbkdf2:sha256:<iter>$<salt>$<64 hex>'.",
      "type": "object",
      "additionalProperties": false,
      "required": [
        "name",
        "key_hash",
        "rules"
      ],
      "properties": {
        "name": {
          "type": "string",
          "minLength": 1
        },
        "key_hash": {
          "type": "string",
          "pattern": "^(sha256:[a-f0-9]{64}|pbkdf2:sha256:[0-9]+\\$[a-f0-9]+\\$[a-f0-9]{64})$"
        },
        "rules": {
          "type": "array",
          "minItems": 1,
          "items": {
            "$ref": "#/$defs/rule"
          }
        }
      }
    },
    "network": {
      "description": "A source CIDR range with its own set of command rules.",
      "type": "object",
      "additionalProperties": false,
      "required": [
        "name",
        "range",
        "rules"
      ],
      "properties": {
        "name": {
          "type": "string",
          "minLength": 1
        },
        "range": {
          "description": "IPv4 or IPv6 CIDR (e.g. '10.0.0.0/8'). Validity is enforced at load time.",
          "type": "string"
        },
        "rules": {
          "type": "array",
          "minItems": 1,
          "items": {
            "$ref": "#/$defs/rule"
          }
        }
      }
    },
    "logTargetStdout": {
      "description": "Log target that writes human-readable text to stdout.",
      "type": "object",
      "additionalProperties": false,
      "required": ["target"],
      "properties": {
        "target": {
          "const": "stdout"
        },
        "log_level": {
          "description": "Minimum log level for this target. Overrides the global log_level.",
          "type": "string",
          "enum": ["DEBUG", "INFO", "WARNING", "ERROR", "CRITICAL"]
        }
      }
    },
    "logTargetJsonFile": {
      "description": "Log target that writes JSONL (one JSON object per line) to a file.",
      "type": "object",
      "additionalProperties": false,
      "required": ["target", "filepath"],
      "properties": {
        "target": {
          "const": "jsonfile"
        },
        "filepath": {
          "description": "Path to the log file. Relative paths are resolved against the log directory.",
          "type": "string",
          "minLength": 1
        },
        "log_level": {
          "description": "Minimum log level for this target. Overrides the global log_level.",
          "type": "string",
          "enum": ["DEBUG", "INFO", "WARNING", "ERROR", "CRITICAL"]
        },
        "max_file_size_mb": {
          "description": "Maximum file size in MiB before rotation.",
          "type": "integer",
          "minimum": 1,
          "default": 10
        },
        "backup_count": {
          "description": "Number of rotated backup files to keep.",
          "type": "integer",
          "minimum": 1,
          "default": 5
        }
      }
    },
    "logTargetTextFile": {
      "description": "Log target that writes human-readable text to a file.",
      "type": "object",
      "additionalProperties": false,
      "required": ["target", "filepath"],
      "properties": {
        "target": {
          "const": "file"
        },
        "filepath": {
          "description": "Path to the log file. Relative paths are resolved against the log directory.",
          "type": "string",
          "minLength": 1
        },
        "log_level": {
          "description": "Minimum log level for this target. Overrides the global log_level.",
          "type": "string",
          "enum": ["DEBUG", "INFO", "WARNING", "ERROR", "CRITICAL"]
        },
        "max_file_size_mb": {
          "description": "Maximum file size in MiB before rotation.",
          "type": "integer",
          "minimum": 1,
          "default": 10
        },
        "backup_count": {
          "description": "Number of rotated backup files to keep.",
          "type": "integer",
          "minimum": 1,
          "default": 5
        }
      }
    },
    "settings": {
      "description": "Runtime settings. All keys are optional; unspecified keys fall back to bundled defaults.",
      "type": "object",
      "additionalProperties": false,
      "properties": {
        "max_output_length": {
          "description": "Maximum length of command output returned to LLMs. An integer byte count or a size string (b/kb/mb/gb, case-insensitive, e.g. '50kb').",
          "oneOf": [
            {
              "type": "integer",
              "minimum": 1
            },
            {
              "type": "string",
              "pattern": "^\\s*\\d+\\s*((?i)b|(?i)kb|(?i)mb|(?i)gb)?\\s*$"
            }
          ]
        },
        "command_timeout_max": {
          "description": "Maximum timeout (seconds) for remote command execution.",
          "type": "integer",
          "minimum": 1
        },
        "retry_max_attempts": {
          "description": "Maximum number of SSH connection attempts (including the first).",
          "type": "integer",
          "minimum": 1
        },
        "retry_backoff_base_seconds": {
          "description": "Base delay (seconds) for exponential backoff between SSH retries.",
          "type": "number",
          "exclusiveMinimum": 0
        },
        "circuit_breaker_failure_threshold": {
          "description": "Consecutive per-target failures before the circuit opens.",
          "type": "integer",
          "minimum": 1
        },
        "circuit_breaker_timeout_seconds": {
          "description": "Time (seconds) an open circuit waits before allowing a half-open probe.",
          "type": "number",
          "exclusiveMinimum": 0
        },
        "log_level": {
          "description": "Logging level. One of: DEBUG, INFO, WARNING, ERROR, CRITICAL.",
          "type": "string",
          "enum": [
            "DEBUG",
            "INFO",
            "WARNING",
            "ERROR",
            "CRITICAL"
          ]
        },
        "logging": {
          "description": "Logging configuration. Defines log targets and their settings. When absent, falls back to legacy behavior: a single JSONL file target in the default log directory.",
          "type": "object",
          "additionalProperties": false,
          "properties": {
            "log_targets": {
              "description": "Array of log target objects. Each entry defines a log output destination. Multiple targets are supported simultaneously.",
              "type": "array",
              "minItems": 1,
              "items": {
                "oneOf": [
                  {
                    "$ref": "#/$defs/logTargetStdout"
                  },
                  {
                    "$ref": "#/$defs/logTargetJsonFile"
                  },
                  {
                    "$ref": "#/$defs/logTargetTextFile"
                  }
                ]
              }
            }
          }
        },
        "max_log_output": {
          "description": "Maximum number of output characters stored in a log entry. Applied to all targets that support output truncation.",
          "type": "integer",
          "minimum": 1,
          "default": 4096
        },
        "compress_rotated": {
          "description": "Whether rotated log files are gzip-compressed. Applied to file-based targets.",
          "type": "boolean",
          "default": true
        },
        "pool_max_connections_per_target": {
          "description": "Maximum number of idle connections kept per SSH target.",
          "type": "integer",
          "minimum": 1
        },
        "pool_idle_timeout_seconds": {
          "description": "Time (seconds) an idle pooled connection is kept before eviction.",
          "type": "number",
          "exclusiveMinimum": 0
        },
        "pool_cleanup_interval_seconds": {
          "description": "Interval (seconds) between idle-cleanup sweeps of the pool.",
          "type": "number",
          "exclusiveMinimum": 0
        },
        "max_concurrent_ssh_connections": {
          "description": "Global maximum number of concurrently checked-out SSH connections across all targets. Excess acquisitions are rejected with an HTTP 503 Service Unavailable response rather than queued.",
          "type": "integer",
          "minimum": 1
        },
        "watcher_debounce_seconds": {
          "description": "Minimum delay (seconds) between config reloads on file change. 0 disables debouncing.",
          "type": "number",
          "minimum": 0
        },
        "trusted_proxies": {
          "description": "Optional list of trusted reverse-proxy IP addresses. When non-empty, the X-Forwarded-For header is only honored when the direct connection peer is in this list. An empty list (default) means no proxy is trusted and the header is ignored entirely. Entries must be valid IP addresses (IPv4, IPv6, or IPv4-mapped IPv6).",
          "type": "array",
          "default": [],
          "items": {
            "type": "string"
          }
        },
        "rate_limit": {
          "description": "Per-IP rate-limiting settings. Set enabled to false to disable rate limiting entirely (e.g. for test suites issuing a high request volume from a single client IP).",
          "type": "object",
          "properties": {
            "enabled": {
              "description": "Whether per-IP rate limiting is active. When false, the rate-limiter is disabled at startup.",
              "type": "boolean",
              "default": true
            },
            "max_requests_per_minute": {
              "description": "Maximum requests allowed per client IP within the sliding window.",
              "type": "integer",
              "default": 60,
              "minimum": 1
            },
            "window_seconds": {
              "description": "Sliding-window duration (seconds) for rate limiting.",
              "type": "number",
              "default": 60,
              "minimum": 0
            },
            "cleanup_interval_seconds": {
              "description": "Minimum interval (seconds) between expired-entry garbage collections.",
              "type": "number",
              "default": 300,
              "minimum": 0
            }
          },
          "additionalProperties": false
        },
        "sftp": {
          "description": "SFTP file-transfer settings.",
          "type": "object",
          "properties": {
            "sandbox_root": {
              "description": "Root directory that constrains all SFTP paths via realpath. '/' means unrestricted.",
              "type": "string",
              "default": "/"
            },
            "max_path_length": {
              "description": "Maximum allowed length (bytes) for SFTP remote paths. 0 disables the check.",
              "type": "integer",
              "default": 4096,
              "minimum": 0
            }
          },
          "additionalProperties": false
        }
      }
    }
  }
}
